{
  "$schema": "https://json-schema.org/draft/2020-12/schema",
  "$id": "https://contracts.logistrack/schemas/BloqueConsolidadoListo/1.0/cloudevent.json",
  "title": "CloudEvent BloqueConsolidadoListo v1.0",
  "type": "object",
  "required": [
    "specversion",
    "type",
    "source",
    "id",
    "time",
    "datacontenttype",
    "dataschema",
    "subject",
    "data"
  ],
  "properties": {
    "specversion": { "const": "1.0" },
    "type": { "const": "logistrack.distribucion.BloqueConsolidadoListo.v1" },
    "source": { "type": "string", "minLength": 1 },
    "id": { "type": "string", "minLength": 1 },
    "time": { "type": "string", "format": "date-time" },
    "datacontenttype": { "const": "application/json" },
    "dataschema": {
      "type": "string",
      "format": "uri",
      "pattern": "BloqueConsolidadoListo/1\\.0/schema\\.json$"
    },
    "subject": { "type": "string", "minLength": 1 },
    "traceparent": { "type": "string" },
    "data": {
      "type": "object"
    }
  },
  "additionalProperties": false
}
